{
  "session_id": "S-1762361747",
  "manager_id": "alex",
  "created_at": "2025-11-05T08:00:00Z",
  "updated_at": "2025-11-05T08:10:00Z",
  "stage": "qualification",
  "history": [
    {
      "role": "manager",
      "content": "Здравствуйте! Меня зовут София. Подскажите, кому готовим песню?",
      "stage": "greeting",
      "ts": 1762361147.3738613
    },
    {
      "role": "client",
      "content": "Для жены, у нас годовщина.",
      "stage": "greeting",
      "ts": 1762361148.373863
    },
    {
      "role": "manager",
      "content": "Как красиво! Сколько вы вместе? Хотите романтику или тёплую лирику?",
      "stage": "qualification",
      "ts": 1762361167.3738632
    },
    {
      "role": "client",
      "content": "8 лет вместе, пусть будет романтика.",
      "stage": "qualification",
      "ts": 1762361168.373864
    }
  ],
  "scores": {
    "combined": 82,
    "rule": 8,
    "llm": 8
  },
  "issues": [
    "no_recap"
  ],
  "tips": [
    "Сделай короткое резюме перед оффером.",
    "Заверши мягким CTA с выбором."
  ],
  "meta": {
    "source": "voice_arena",
    "lang": "ru"
  }
}